"78783 Sarah Rue,Juliafurt,Pakistan,Any billion school available under example.,(501)854-7040x673"
"063 Brianna Ridge Apt. 372,Webermouth,Macedonia,Dark general as support.,+1-947-517-6934x2454"
"5202 Murray Mission,Butlermouth,Azerbaijan,Woman catch event leader outside.,694-021-7769x8839"
"49567 Richard Vista Apt. 033,Port Jennifer,Switzerland,Bill near ball quickly.,888-122-2147x00010"
"784 Simmons Port Apt. 162,Lake Shannonside,Malawi,Spring gun southern politics night then Mrs low.,001-533-475-5928x5702"
"1466 Brown Loop,Smithmouth,Christmas Island,Attorney serious policy food.,473.572.9399"
"69076 Diaz Center Suite 378,Johnburgh,Saint Martin,Expect natural forget agree final.,(749)140-9207"
"70308 Howard Motorway Apt. 621,Christianville,Sweden,Fish his ask wide inside series big around.,(764)164-5414x8607"
"44454 Larry Inlet,West Paulview,Antarctica (the territory South of 60 deg S),Like be concern without tree occur.,+1-742-944-0486x21075"
"2247 Mercedes Extensions,Martinezbury,Antarctica (the territory South of 60 deg S),Result successful might either respond thank single father.,984.912.8684"
